,Date_Epoch_Week,Review_Text
417,2550,Has to be one of the most satisfying games I have ever played!
418,2550,"Awesome puzzles, awesome story"
419,2550,"Very interesting and challenging puzzles. There is never one way to solve the puzzles either, its a nice mix of creativity and logic."
420,2550,"I usually play a totally different type of game and even when I play puzzle games I prefer a simpler style.So I was really surprised how soon this game dragged me into it and how much I like it!!This game is challenging but never so much that it results in frustration. And it is really satisfying once your machines finally run and therefore super addictive.My boyfriend and I play it both and have so much fun competing who built the best, most efficient, fastest machinery or  how to get the achievements.I love how this game doesn't have this one solution to figure out. No, everyone has his own way of thinking and finds his individual way to solve the puzzles. It's really great!This game deserves way more attention! Highly recommended!"
421,2550,my head hurt mom help
422,2550,"If you like block-puzzle games, this is quite nice. Not a hard challenge, but you have to combine known elements in new ways regularly. Well worth the price."
423,2548,"Very bland. Cool conept and theme but the goals are boring and unrewarding. Each level gets increasingly difficult and if you dont understand, well, theres no hints other than little holograms that basically tell you nothing. I see how this game could be done well but I haven't seen much of it."
424,2548,Zach never lets you down. You let yourself down cause you can't solve the puzzle.10/10 would buy another Zachtronics game to feel frustrated.
425,2548,Juas got this game at under 7 dollars.  Im about an hour and a half in.. Absolutely worth it! Peaceful and a lot of fun. Controls are perfect when you are trying to build the perfect machine to complete the task you are never fighting the interface. Very creative and if you want an absolutely fun factory game that is pick up and go with little to no frustration this is it. You cannot go wrong for the price. You will be thinking of solutions to a puzzle all the time and be dying to get back and try your new Idea.
426,2548,Design assembly lines in different ways to maximize different criteria.  It's fun!
427,2548,is cool
428,2548,"Me not so smart, me have hard time, me still like this game."
429,2548,+ nice puzzles
430,2548,The game feels useless and is not intertaining it would be more intertaining if you were able to make anything you wanted beseides what they want you to make like run your own actual factory i would not recommend buying this game
431,2548,"Really really good game!  Probably my favorite Zachtronics game.  But it's sort of hard to write a review for...  How would you know if you'd like this sort of game or not???  I guess if you think you -might- like this sort of game, this is probably the one I'd recommend starting with.I do have a theory that this would make a great intro to programming.  I think it does a great job of introducing the idea of breaking a process down into logical sub steps.  But because of the 3D and more 'tangible' activity you're accomplishing, it seems totally removed from the 2d wall of syntax people seem to have trouble with.I would recommend giving it a while since it has sort of a slow start.  I'm a fan of all the Zachtronics games but I was several (maybe as many as a dozen?) levels into this one before I really got into it.  I was even thinking about returning it!  Maybe it started so slow that it took a while to get into the meaty puzzles."
432,2547,"[tl;dr]It's a great game if you enjoy logic tests and optimization, and a good introduction to the Zachtronics style.[Overview]Infinifactory is likely the most ""accessible"" of Zachtronics' various ""puzzle"" games, at least insofar as my experience goes. It's very intuitive, which is a good thing because unlike most of Zachtronics' other games there's no 30-page-long manual to understand the mechanics; they just throw you into the game with a few tools and continually drip-feed new tools to keep the solutions more and more complex. I'd personally recommend this to people who are new to this studio's games and want a warm-up before diving into the depths with something like Opus Magnum or SpaceChem.I'm not the best judge of music, so I'm not going to rate it one way or the other. The sound effects, however, are very satisfying, particularly when you've got a complex machine constantly pushing and welding in rhythm.Visually speaking, it looks like a massively updated Infiniminer. While it's tough to say that it has the same sort of striking visuals as some of their other games, more than anything it needs to be evidently clear which bit of a Rube Goldbergian assembly line does what, and in that regard they are successful.More so than anything, the only advice I can really give is: Experiment. Test out all the different blocks and the way they interact with each other. The more little quirks you notice, the more you feel like a genius and the more satisfying it will be when it all comes together."
433,2541,A satisfying puzzle game. Highly recommended.
434,2540,The closest thing i would link this to is a hardcore puzzle focus version of Portalspeaking of whichIs it just me or would this game be even better with Co Op support?
435,2534,it stinks
436,2534,"If you like 3D puzzles that require a lot of thought, then this game will suit you well.It has a lot of content and some very challenging puzzles."
437,2534,"Factorio meets Minecraft. Assemble increasingly complex assembly lines to convert inputs into outputs in a colorful set of alien worlds. From conveyors to pistions to logic nodes to even laser beams, you'll be tasked with all manner of jobs by your indifferent, alien overlords for whatever odd, dull reasons they have. Chairs, turrets, robot tanks, spaceship parts... what are they up to? And will you ever make it home if you complete enough shifts?A fun and wonderful story makes this Zachatronics game something I love to recommend to others. Unlike many others by the same developer, this one features easy to learn and tactile sets of tools in a fully 3-D space, allowing you to manufacture all kinds of fun solutions. Listen to the radio logs tethered to the corpses of less-fortunate coworkers, all while traversing dozens of planets, each and every one being stripped for resources to feed an ever-hungry empire."
438,2533,"Fun for programmers like any Zachtronics game, but in 3D a-la Minecraft."
439,2532,"Wait, I thought this was Factorio"
440,2531,Not really particulary interesting.
441,2530,"The game is well made, it has beautiful graphics, but the one problem it has for me is that the game itself is too hard. I'm not new to puzzle games but you aren't given much at all towards what the blocks do and I found myself being stuck on levels with no clue on how to solve them. I definitely feel like they could have given more help/info towards how to solve levels which probably would have made me keep this game."
442,2530,"I recommend this for anyone thats hardcore puzzle solver, this will take alot of time from you to beat it. The whole point is creating your own factory and create/destroy stuff and put them in the right place and send it to the hologram in order to complete the game. Reason why I said ""hardcore"" because this game is by far very difficult even in the beginning level. Its tedious at times as well because despite how you make it, theres always something that messes up and you have to fix it.For me I tend to get bored at times because I would use the walkthrough and sometimes create my own similar style to the walkthrough I saw. I know I'd be lying if I said this isnt a challenge. My small issue with this game is that I wish they made it a bit easier in the beginning levels. Other than that, very fun if you are up for a challenge."
443,2530,"Really good game, I'm greatly enjoying the puzzles so far. Makes me think and makes coming up with the solution very satisfying."
444,2530,fun game tbqh
445,2530,"Really cool game, but you can play it out whitin 30 hours"
446,2529,"I am reccomending the game because it isn't bad, BUTIn all honesty, this is probably the weakest of all the Zachtronics games. The puzzles themselves are fairly fun and its very satisfying to watch the creation you've made  after a long time tinkering.That being said, the fact that they made this first person really does it no favors. It makes things take longer to tinker with and makes building feel a bit cludgier. There doesn't seem to be any real reason or need for it to have been 1st Person and that design decision seems actively makes the game feel a little worse. Additionally, the storyline itself seems far weaker than the other games they have made, nor does the art design really stick with me like any of their other games do. If you're a fan of Zachtronics other games and are looking for more, this is absolutely worth the buy, but if you're new, I would heavily reccomend playing either SpaceChem or Opus Magnum first. If you're not a fan of those games, this game probably won't do much for you either."
447,2529,Worth it =)
448,2529,"When I play this game I enjoy it. The puzzels are tought but not imppossible and the enviroment/setting is intresting. However it crashes far too often for me to recommend it, it has started to happen now every 30 seconds."
449,2529,"The game doesn't treat you like a dumb person, nor a person who knows everything. It knows how to guide you to push yourself without holding your hand."
450,2528,"Loved this game.  Still have not beaten all the levels, after almost 300 hrs of play time.  I wish Zachtronics would add some more levels as DLC.  I also wish that there would be an update adding some new concepts, like letting the conveyors and welders to be ued in all 3 dementions not just 2 or  like the on/off switch, that you don't get until the end and then it doesn'r seem to be used in any non-custom levels and controls very few blocks in the game.  But, overall great game.  highly recomended."
451,2528,A production line puzzle game but with more emphasis on the puzzle.
452,2527,"Very good game, but extremely bugged on my amd machine. Disappointing for a $25 game. It crashes about every 15 minutes. The only game that experiences this problem on my computer, and I can run Elite: Dangerous on max settings at 1440p and get 100 fps."
453,2527,"I wonder if this game has an end to it. I played and played and played. The game got harder and harder. It's been a while since I played, but the last thing I remember is being up in the early hours of the morning designing a system that would slice up a whale and send its white and dark meat into separate processing stations.Okay, but it doesn't start off that way. The thing starts you off real easy like. Gives you a few primitives and tells you to move some simple stuff around. No big deal. Next thing you know you are slaughtering whales and making guns for some aliens. I need to pick it back up again, but it was so addictive I had to uninstall it. It had me captive and I fell in love with it in proper Stockholm style. I was seeing this game when I closed my eyes. I woke up in cold sweats when my factory footprint was getting out of hand in my dreams...Give it a try, it will make you stronger."
454,2526,InFunagamory
455,2525,"A great problem-solving game. I haven't gotten very far yet but I can say that this game goes easy on you, unlike spacechem. It teaches the concepts one by one, letting you learn. Buy it if you like coding or puzzles in general."
456,2525,One of the more accessible Zachtronics games - very enjoyable and addicitve!
457,2525,"The game designers did a good job in showing you the controls and what can basicly be done with the blocks without spoiling solutions. But you can find lots of hidden mechanics by combining certain tools that make your life much easier. Also the design, the sound and the story of the game are well done.After a few hours of having fun I thought I finished the game. Then I realized, that I only finished the first part of the game. The second part was... mindbending. The game teaches you to develop your very own style of solving these puzzles and somehow I feel much smarter now :-)"
458,2524,"It took me a while to get into the game, but the moment I did, I couldn't put it down. The puzzles are more than satisfying, and I found myself continuing to think about the solution even after I moved on. The game is addictive beyond all else, really."
459,2524,Compelling engineering game; just when you think you beat it there's a whole other set of levels.  I love Zachtronics games and this does not dissapoint.  3D puzzle building allows a lot of possibilties.
460,2523,"Very happy with the interface, pacing, and overall tone of the game. Puzzle games need some edge, and this delivers, so long as you don't look too critically. Really love how you don't have a 20 minute pedantic tutorial with a narrator that talks to you like you're some kind of moron. See thing, do thing. Go go go!"
461,2522,I kind of thought this would be like a 3d factorio or minecraft for some reason. It's more like an episodic puzzle game though. Still pretty fun.
462,2519,Lets start. The game started with me crashing all the time. I used the report an issue feather and the developer made me aware that it was my onedrive causing the crash ( i knew it was a read write error but i was not even thinking about onedrive ) Disabling onedrive save fixed the issue. I got an answer in less then one day. This in its alone speaks of really good support !Beside that the game is really nice and fun brain teaser. There is really no cons i can thing of only pros with this game and the developer. Therfore its a clear upvote for me here
463,2519,i was downloaging from the workshop when i haven don the campane it wont let me play the maps i download [WARNING HAVE TO DO THE CAMPANE] STUPED GAME!!!!!!!!!!!!!!!!!!!!!!!!!!!!!!!
464,2518,This is more then a puzzle game. With a small selection of part types you must build a sometimes complex factory that converts a timed feed of raw materials to the final product. It is a puzzle in three dimensional space and time. I have played games all my life and this unlike anything I have ever played. The experience is more like a graphical representation of building an electronics skematic or writing a software application. You start out solving simple tasks and in no time you are building complex machines that you can just sit back and enjoy watching run. Sooo satisfying!!!
465,2518,"Puzzle-mechatronics. One of the most insane, creative games ever seen."
466,2518,"Nice game, love how the leaderboard statistics show that others have found better solutions than you pushing you too improveThe game is very long though, still havent finished it maybe Ill get back to it later"
467,2517,"Its a good puzzle game, a thinking game. If you want a fun puzzle game with a story, thing portal, if you want a thinking puzzle game, where you can spend hours making things more efficent or just figuring out how to solve the damn thing, think inififactory. its a good game, but id wait for a sale, unless youre an engineer or want to learn about basic basic manufacturing"
468,2516,"Really enjoyed this.  A few levels were true mind benders that force you to adapt new techinques into your factory building that I really enjoyed.  But some of the later levels aren't hard per say, but rather just too labor intensive... I see the solution, but actually buliding it and hammering out the details would just take too long and other games have caught my attention =)I do recommend the game though.  It's a really fun 'problem solving' type of game."
469,2516,This game is very fun on a lot of levels.  Carefully figuring out each puzzle piece-by-piece is an incredibly satisfying experience.  Some levels I test / small fix / retest several dozen times before it works perfectly but each failure / success is a fun learning experience.  I also really love the sound effects and ambient noise of the Cell (where you select puzzles / objectives) and various levels.The controls for building and moving around are rock solid and very intuitive.  The basic concept of the game is very easy to learn.
470,2516,"If you've never played a Zachtronics game or have been scared by the difficulty of their other games, this is the perfect game to start with. I recommend the game for it's first half, where I really though like my mind was adapting to the rules of the game, and slowly increased my efficiently came naturally. The eureka moments are great where you think of new concepts.However If you are not confident in your problem solving abilities, like myself, I recommend stopping at the mid point (clearly divided, you'll know) as the later puzzles start to feel like you are fighting the game rather that fighting your brain. Stuff like material efficiency seems like a cheap way of making you restart a puzzle 1 hour in. By the end of the game I was spending multiple hours on each factory and seeing the factory break on items 7 was heartbreaking.The main mechanics were great but I would have prefered some more functionality. For example timers and auto-toggles. A copy/paste page, saved custom parts. The other thing that would help is guidebook for different systems, this would allow for a more natural understanding of concepts, instead of the nature of having a non-efficient version that ends up ruining your build."
471,2515,"One of the best puzzle games to be found. People who are giving bad reviews because it is too hard is just ridiculous and direspectful.The feeling of viewing your machine putting parts together, and it works, is just amazing. This game share almost the same mechanics as the new 2d-puzzle game Opus Magnum, but I like this one much better."
472,2513,"Infinifactory follows the same formula as SpaceChem and Opus Magnum, except w/ a 3-D first-person view.The problem is this: trying to solve a puzzle in 3-D involves overhead of maneuvering your character and camera.  This creates tedium, which detracts from the core of the game, which is solving puzzles.If you don't own any Zachtronics games, get Opus Magnum and/or SpaceChem first.  If you want a fresh take, try this one.  On its own, it's a good puzzle game, so I won't penalize Zachtronics for making better ones."
473,2513,dus is good
474,2511,"Boring. Repetitive. Thought it would be more like factorio, but in 3d. But this is just a basic ass puzzle game."
475,2511,"I love everything about this game honestly. Rather than figuring out a specific answer to a puzzle, as long as you create a solution that works- you succeed. At the end of each level, it shows you some stats about how other people did in order to encourage you to change your design. I've found it to be a lot of fun to make the most arbitraty design as possible, but there's a definite triumph in creating the most efficient machine you can.  There's also a bit of humor in its lore which I found enjoyable.If you are interested in puzzles and enjoy a good challenge definitely pick this up!"
476,2510,Just buy it. Ingenious game.
477,2509,Please let me skip the intro and the tutorial and anything else I'm going to be forced to endure mindlessly...
478,2508,Very good and challenging game. Unexpected in many ways especially towards the end.
479,2508,"Zachtronics creates games that ask the player to build a solution to solve a problem. I like these types of games and have written good reviews on a few Zachtronic games. I really want to write a good review of Infinifactory but I can't. My problem with this game is while it is okay to invest some time in order to solve a problem, there is such a thing as making it too hard to figure out. Right from the first training puzzle, the thing I felt was missing that was not the case in other Zachtronic games was the needed components to construct the solution. Shenzhen IO, TIS/100 and SpaceChem always had enough of the basic elements -- motion, a grabber, and a switch -- to complete the problem. With infinifactory, the grabber -- which in this case would be a clamp -- was missing and it was sorely needed on the third training puzzle where I had to weld a vertical two-block stack, then move the union to the transporter. There was simply no way to join two falling objects at different altitudes into a union and then at command move the union to the transporter. I spent a total of 2 and a half hours on that one puzzle before finally giving up and uninstalling.When something becomes too hard to do, it stops being enjoyable. Infinifactory made the learning curve much too steep at the beginning and I truly feel it should have followed a more shallow incline demonstrated in the other games."
480,2508,"PROS:+The puzzles are challenging, but not to the point where it's frustrating.+The game is well optimized. It starts up EXTREMELY fast and runs smoothly.+The worldwide player statistics system is awesome. It adds a little minor competition that is totally optional.+The gameplay is intuitive and everything works as expected.+Awesome Soundtrack+Steam Workshop.CONS:-The story is pretty bland. It sets a nice premise, but later in the game it's just slightly annoying.-The voice acting isn't great.Over all this game is great if you're looking for some fun logistics problems to solve. It's extremely satisfying when you complete a tough challenge, too. I'd definitely recommend this."
481,2508,Only people with a very high IQ can play this game. I suggest you watch Rick and Morty first.
482,2507,"ladies and gentlemen. presenting the successor to the game that inspired minecraft. T.H.E. voxel-game codifier. this game will make you feel so smart one moment, incredibly stupid the next, make you ragequit in frustration, only to come back and FINALLY finish that stupid thing you wanted to fix!... and then ragequit again when something stupid goes wrong for seemingly no reason whatsoever...this is a great way to get into Zachtronics puzzle games without needing an electronics or programming background."
483,2507,"The game has simple graphics. The first stages of the game teach you how to work out the different components of the puzzles. From there on, the difficulty ramps up pretty quickly, puzzles become very hard and take a long time to complete. For this reason, I stopped playing the game."
484,2506,not my cup of tea
485,2506,"This game puts you in the position of an alien abtuctee that is tasked with manufacturing various constructions from supplied materials for your new masters. Your role is to design and construct the ""factory"" to make each construction. In order to prove that your process works, you must deliver 10 perfect copies of the requested item to a ""scanner"" that validates that each copy delivered is correct. As you progress, you are given additional tools, more challenging conditions/restrictions and more complicated items to assemble. I first learned about this game through a YouTube reference/review from Mark Brown's Game Maker's Tool Kit (search for it and watch it) that put this game in the genre of ""Problem-Solving"" rather than ""Puzzle-Solving"". The distinction is worth noting. This game allows you to develop many potential solutions to each problem - and rates you on the time, moving part and space efficiency of your solution in the form of showing your performance relative to that of all the other Steam players.You have unlimited design time to develop your solutions, and, apart from the final level, there are no practical time limits to how long your solution can take. There's even an achievement (""Subversive Engineering"") for the running time of your (successful) solution being a really long time. Because you learn to use each new element one at a time, I never found the learning curve too intimidatingly steep, and the sense of reward when you solve a problem stage is strong. It is also possible to ""finish"" the game without completing all of the problem scenarios, in case there's one that you are having fits over.  I've put over 150 hours into this game. Not because it's difficult to complete, although some of the campaign puzzles can really stretch your brain, but because I've wanted to ""beat"" the efficiency requirements to get all the achievements and develop better solutions.Although there is Workshop support, I haven't done any of the Workshop levels yet. (I'm trying to work through other games in my library first...)"
486,2505,"I've enjoyed this game a lot, makes you think outside the box, especially when trying to improve designs to get a better score.The initial set of levels are easy, and it wasnt up until the final lot of levels that Ive begun to struggle, a lot. Ive yet to complete the entire game, and I return from time to time in the hope it might click this time around, it usually hasnt.A great game for anyone who enjoys puzzles, there is something here for most, and the workshop opens some challenges to those willing to find even harder levels."
487,2505,I just love it and keep on coming back to it.Great puzzle that always offer multiple possibilities.
488,2504,Fun puzzle mechanics
