,Date_Epoch_Week,Review_Text
489,2503,"This is one of the best puzzle games I've played. Even though its individual puzzles take a long time to solve, the satisfaction of creating your own solution makes them worthwhile. Pros:There are numerous methods to finish every puzzlePuzzles are mentally engaging, and often very difficultThe soundtrackThe humor--such as The miners and the hamster pelletsThe failure logs keep you from burning outThe game lets you save an incomplete solution and come back to it later. This helps in the later puzzles where building becomes very time consuming.Cons:Mouse movement can be a bit wonky.Objects fall a little too slowly, and this makes it harder to time falling objects.Overall, I would recommend this game to any person who loves to solve puzzles. It's been a blast so far, and I haven't even finished the game!"
490,2503,"This game is very difficult, so if you're a casual puzzle gamer this may not be for you. The learning curve is steep, expecting you to learn things on the fly and giving you little time to process new concepts. But it is one of the most rewarding puzzle games I've ever played. This is a big step up from SpaceChem, which is also fantastic...they are essentially the same game, but the 3D environment makes it much easier to comprehend and visualize how cycles will play out. Much like SpaceChem, I'll spend ages staring at a problem with no clue how to approach it, then something eventually clicks and I am able to construct a solution. Maybe not an optimized one, but one that works, and the ""leaderboard"" system lets you know how close you are to other players' best solutions. I look forward to getting frustrated as hell at the next Zachtronics game I pick up!"
491,2503,"As far  as I can see the checkpoints are pretty poor on a Mac at least . It is just a waste of time to have to replay huge chunks of the game. However, after playing more the check points are quite good afterall."
492,2502,"I like this game, I really do.The lack of a windowed mode for linux just makes it completely impossible to play, the game starts up on the wrong monitor at the wrong resolution so half of the game isn't visible.This has been an issue since the game came out as far as i know and hasn't been fixed."
493,2501,Pretty good puzzle game that is surprisingly hard
494,2500,"This game is really hard. Soon after the tutorial levelos it gets to the point where it seems to take an hour to fihgure out a puzzle, but when you do figure it out, it feels really good. I want to stress that these are hard puzzles, but they are still fair. You can tell there's a solution to it, you just haven't figured it out yet."
495,2500,Really like this one.  Easy yet challenging.  Good chill out game.
496,2499,"Excellent problem solving game. These are not puzzles in the sense that you have to figure out the correct way to do it, instead you are given a large space to work out one of many solutions, each possibly being better than others in different ways. A factory that works in parallel might go the fastest, but making sure everything doesn't collide means a large footprint. A compact build might be really slow. Apart from a few achievements, it is up to the player to decide which they want to focus on."
497,2499,"This is another one of those ""programming puzzle"" games, one where you can have multiple solutions to each puzzle. And once you do manage to complete the task, you usually find yourself trying to come up with another solution just to make things run more efficiently.Some have called this game ""SpaceChem in 3D"", and I wouldn't say that they're too far off the mark. That third dimension adds enough fun and challenge to an interestingly quirky game."
498,2499,"I like those kinds of puzzle games, but there is no decent tutorial nor do I like the controls. It just feels uncomfortable to solve the puzzles. This game looks like something a single guy made in their spare time. Definately not worth the asking price. Worth maybe 5 bucks but definately not more.If you include cutscene in you game make them either pretty or skippable. :/"
499,2499,"Really incredible puzzling/programming game. New mechanics are introduced at a good pace to keep puzzles interesting and the story (while light and easily ignored) is funny and well-integrated with the puzzles.As a bonus, it runs well even on my dinky Linux laptop with integrated graphics!"
500,2499,Amazing!!!
501,2499,"Liking it so far, yet it crashes sometimes for no reason?"
502,2499,"i liked it, though jus tthe first chapter, Its becomes incredible hard at chapter 2, x3If you like puzzlegames then this one is for you! :D"
503,2499,"A totally unique and immensely deep puzzle game. Honestly unmatched in terms of mechanics and depth; there is never ""one solution"" for a puzzle. Absolutely recommended."
504,2498,"If you liked the building/puzzle aspects of SpaceChem but felt constrained by the limited space, fret no more, Infinifactory is here!  You can build machines as big or small as you want; these machines then take in the input material, whack, chunk, and carve them appropriately, and pass them to the output gateway.  Your creations are rated on size, amount of parts used, and speed, and you can make different solutions for each criteria to try and improve your craftmanship.  There is a backdrop story of being kidnapped by aliens in order to design their factories, just enough to keep you immersed in the fun of construction."
505,2498,"A ""puzzle game"" in which you're not looking for a solution.You're making the solution."
506,2498,A very enjoyable game for those with the patience to learn and understand the mechanics.Though you need to be in the mood of solving puzzles when you play this game.
507,2498,"It is a pretty good game, but it is not what I expected be."
508,2498,A great challenge
509,2498,"Rating: 8.5Highly recommendedInfinifactory is a very challenging but fair 3D puzzle game. The goal is to take the component blocks supplied and construct/deconstruct them as the 'end goal' displays. This game is not unfair, as the only true obstacle between you and completing the puzzle is your own ability to make the production line between point A and point B. While there is one single puzzle from my memory that has 'RNG' applied to it, the rest of the puzzles are predictable and do not throw anything unexpected or unpredictable at you. The puzzles do ramp up in complexity rather fast, but the goal of each puzzle stays the same, only with more blocks added in to the solution. There is no point where you should feel like youre fighting the game to complete a puzzle, and each finished level gave a strong sense of satisfaction.The story isn't remarkable, but not unwelcome. When it comes to puzzle games I don't expect story as I am only there for the challenge the puzzles provide, but what was added to this game felt entertaining enough for me to enjoy. The setting as well adds variety to the environments you work in, changing things up just when the surroundings might start to feel same-y. The art style has a cartoon-y feel to it that I enjoy and has been fairly memorable, but I attribute that more to the unforgettable difficulty the game provides rather than the art style itself. The soundtrack is good, the kind of music that plays in the background and does not distract the player while getting rid of any uncomfortable silence, but is also something nice to listen to when you need to step back from a puzzle and think about it without intense focus.Another small feature that adds to the challenge of the game is the scoreboards of Cycles, how fast you can complete the goal, Footprint, minimizing the area your factory takes up, and Blocks, minimizing the utility blocks added in to your factory. There are no scores by the game that youre expected to beat, but each puzzle shows a chart of scores other users have received on the same puzzle. It adds an extra, but entirely optional, challenge in for you to try and optimize your factory as best as you can.Ironically I have not beaten this game, but this is due to my own shortcomings rather than the game. Despite getting stuck I still have a fair bit of time logged and found the game to be highly addictive. The difficulty near the end is very high, and while I do know the solution exists, my own perfectionism and impatience has made me take a bit of a break from the game. That being said, I still think the game is fantastic and unfortunately very underrated, as there isn't anything I can really complain about when it comes to Infinifactory. Zachtronics knew what they wanted to do, they set out and did it, and everything about it feels right. Come to the game for the puzzle, and enjoy the sci-fi worlds they added in while you're bashing your head on your desk trying to figure out one of the level solutions.The only reason this game is not a 10/10 is because they decided to add in a story that was average, but without the story or variation in level environments, I do not think it would be worth the current price tag."
510,2497,Fantastic.
511,2497,"I'm an electrician who performs electromechanical repairs for factories and I can't tell you how much this resembles my job. I have only played the first 2 levels so maybe I haven't gotten to it yet, but I am waiting for the use of AND/OR logic or even normally closed and normally open circuits (ie. let this pusher block stay extended until an object hits the sensor and lets it close). This makes building the circuits a little longer than I'd like.Difficulty-wise, it's just right. I feel my mind working even though the levels aren't too hard. Someone mentioned the use of computers and I'm assuming Zach's going to use assembly language for it because he seems to like that. I'm going to review this game and put it on YouTube when I've finally completed it. I just got the game today and honestly, I do not regret my purchase.So far, the game gets a 9/10 from me. I wish it were a little more serious and had prettier graphics but those things are optional and do not contribute to the difficulty in this game."
512,2497,"This game does everything I want puzzle games to do. The puzzles make me think in the way that makes me feel it in my head. You can take most of the tools that you've unlocked back to previous puzzles to help solve them more easily. Even the story is good. Also, it's easier than SpaceChem. None of the direct control boss puzzles or anything like that."
513,2497,A mind bender for those that enjoy puzzles :)
514,2496,I'm not a big fan of puzzle games and they don't drag me in like an rpg or a strategy game would. This game however is the exception to that and probably the first puzzle game I've ever finished. My playtime is for finishing the story and then grabbing the last achievements so without a sale it's fairly expensive (23 atm) per hour but damn they're good hours. If you even think you might enjoy this game then I'd highly recommend it.
515,2495,"To start with, the game doesn't seem to offer much, but you just have to push through the first few levels to get used to the controls and figure out how the basic components of a production line work together. After that, you can start to think more creatively about solutions.On each level it is usually frustratingly hard at first to come up with a strategy that will work. You try something to get an idea of the flow of the level and at some point after you've scratched your head and gone back to the drawing board a couple of times, you have a eureka moment. It is very satisfying to hone a machine to peak productivity and compare your results with the efforts of your Steam friends. This game is excellent if you want to be challenged to think logically and creatively. If you have no patience, or don't enjoy puzzles, you should give it a miss."
516,2494,The fact that I can't opt out of the scoreboards in any way makes me feel incredibly uncomfortable and I can't stand to play the game with them present.
517,2493,"Buy this game right now. It dosn't matter who you are, buy it. It's really, really, really good.It is hard though."
518,2490,"Infinifactory is the most approachable of the Zachtronics games. This is the one I recommend to friends.Each level challenges you to build a factory to transform input blocks into the desired output. Factory parts are free, but you can't touch anything while the factory runs. If it works, great! If not, resume factory building and fix the flaw. These puzzles will challenge your skill in timing, sequencing, and 3D geometry. There's a quirky alien abduction story too!After solving each puzzle, the game displays histograms comparing your factory to other players'. I spent many hours tweaking and optimizing my factories to understand how players improved their stats. This optimization challenge is strictly optional."
519,2490,"A great Puzzle-Game with at least 100h of gameplay, and then of course you have a living workshop community :D There is also incitament to aim for more effective solutions, since one can compare ones solutions with the global statistics.Have fun!"
520,2489,Great game! Very good for people who like building or puzzles. It has a nice difficulty scaling and the steam workshop keeps the fun going.
521,2489,"A must-have game for problem-solvers and engineer-types.In the game, you design factories to build various finished products needed by your alien captors.  The levels introduce new ideas in a gradual way, and then build on those ideas with more and more challenging levels.  There is no ""right"" way to solve a level, which allows you to be creative and to try out different ideas.  You can also compare your solution to others' via a few metrics to see how your solution stacks up.I found the levels to have a massive amount of replay value.  I enjoyed iterating on solutions to streamline them, looking at other peoples' solutions on youtube for inspiration, and revisiting older levels when I was a more advanced player.  And, even if you do beat the game and solve every level with maximum efficiency, there are user-created Steam Workshop levels which introduce even more new ideas and challenges.The game also has a light but coherent story, a sense of humor, and is fairly polished.Infinifactory is also much bigger than you think it is.  Just when you think you have beaten the game, an entire second campaign is unlocked, with a ton of new levels, a lot of new and interesting ideas, and builds on the story in a satisfying way.Some people have mentioned the ""physics"" of this game.  The engine has what I call ""Game of Life"" physics, by which I mean:  All the blocks are constrained to a grid, and a block can only move one square per cycle.  It's very intuitive when you play it, but it is definitely not ""real life"" physics.A+, 10/10, one of my favorite games."
522,2487,10/10
523,2486,"A puzzle gem, for all of us having an erection looking at one beautiful and optimized assembly line"
524,2485,"Infinifactory is about making use of building blocks provided by your alien bosses to build mechanisms that achieve results required for each scenario. So far (15 hours in), I found that objectives will either involve assembling multiple copies of some gizmo from scratch, or modifying/upgrading pre assembled gizmos that show up.The game lets you loose without a lot of hand holding, which means there is a learning curve which people may respond differently to. You will know if you are adjusting well to that curve if you find yourself getting inspiration from what you did in prior scenarios, as you naturally develop your own arsenal of small solutions or sub-mechanisms. On the other hand, things are probably bad if you find yourself completely stomped and overwhelmed at each scenario with no idea on how to start.I would agree with those who say this is like Spacechem in 3D. If you haven't played that one, I highly recommend it. I found Infinifactory easier, but maybe that's because Spacechem has  somewhat conditioned me on how to think about solutions.Overall I find this is a great game. Kudos to Zach Barth (the author?) for promptly responding to my support request."
525,2485,"If you like puzzles and optimization, this is the game for you."
526,2485,Great puzzle game. Feeling of finally getting your solution working is very satisfying. Part of fun for me is watching other people elegant solutions to puzzles i just finished on youtube - it's crazy how creative those guys are!Btw this game is nothing like Portal which has only one way to solve each puzzle.
527,2485,"Very fun and satisfies my autism. Ironically, it's not very well optimised and I'd recommend using Process Lasso or something similar to get a decent framerate."
528,2485,"Avesome game, love it!"
529,2484,boring
530,2484,I wish I could play this game forever
531,2484,Minecraft + PortalHurts my brain10/10
532,2484,Yep.
533,2483,"I was already a fan of Zachtronics games, but this one is my new favorite by far. More intuitive than the rest, and maybe a little easier on average - and I mean that in a good way. This one isn't quite as exacting as SpaceChem or TIS-100.Very satisfying to perfect your solutions and see your creations in motion. I think I can actually beat this one!"
534,2483,"Great puzzle game.My brain is not particularly designed for puzzle logic games but when I finally find the solution to a level, it feels so good and rewarding!I liked SpaceChem but I loved this game, great job team!"
535,2483,SpaceChem in 3D.
536,2483,"Really wish I could recommend this, but I really can't say I had fun the entire time playing. I might be the wrong type of person for this game, so if you enjoy puzzles that make you think really hard, this might be fun. If you don't enjoy spending longer than 20 minutes on a single challenge, I can't recommend this."
537,2483,"Perhaps the best puzzle game I've played to date.  Other than the creative ways you can come up with to solve, the story actually becomes very interesting... without giving much away, if you play through long enough you start to see it unfold.  Worth."
538,2483,"I feel  as though I've missed something playing this game as I can't complete any of the puzzles without cheating. On top of this, I feel like I couldn't have completed them on my own as I never would have figured out the trick to the solution on my own. The audio has been increadibly buggy throughout so I have to play it on mute all the time. I would refund it if it wasn't for the fact I've played it for more than four hours trying to get past the tutorial.P.S 21:9 support is great."
539,2483,"An amazing game, has lots o diversity from other puzzle games. Very fun and challenging for everyone. Great game, lots of great moments, Absolutely nothing negitive. 1000/10!"
540,2483,"The satisfaction you feel from solving the simple, yet fiendishly tricky puzzles is what makes this game amazing. The options available to you to achieve the goals are sufficiently steep."
541,2483,Fun puzzles but unnecessarily miserable story. Would rather not have listened to a dog die of loneliness.
542,2483,good idea. bad quality.
543,2483,Very challenging. Great game.
544,2483,"As someone coming from games like Factorio, redstone in Minecraft, or things like TIS 100, Infinifactory scratches that itch perfectly. You know, the itch to optimize. The itch to improve. The itch to hack together an abomination of a machine and laugh maniacally as you watch your frankenstein of a factory actually work."
545,2483,---Infinifactory---A strategy and a puzzle game that will make you think about what's going on.I recommend this game for everyone who likes unknown feelings.
546,2483,"Best ever!! If you like Space Chem, you'll definitely like this game!!"
547,2483,"I really like this game. If you like puzzle games and logic thinking this is for you! Only warning i would give is that its a steep curve, definately not the easiest puzzle game, but thats a positive thing imho."
548,2483,"A really superb puzzle game, Infinifactory takes the basic structure of Zachtronic's previous game SpaceChem and expands it both into the third dimension, and in the variety of tools at your disposal.Infinifactory is a surprisingly well paced game, which keeps things fresh by introducing new mechanics on a regular basis, and has ""pallet cleanser"" levels after the particularly difficult puzzles which have you do some rather silly and somewhat macharbre things."
549,2482,"I can only half recommend this game.  I fully recommend it as a puzzle game, but I can't recommend it as a physics-based puzzle game.As a puzzle game, it's got a lot going for it:  it's challenging without being too difficult (so far), it's logic-based, the controls are mostly intuitive, and it's even got sort of a story/lore with some decent humor.However, this game must take place in some alternate universe where the laws of physics aren't applied evenly, and that bugs me.  Since you're scored on how many blocks you use for your solution (with fewer blocks being better), you often have to come up with solutions to the puzzles that would not work in real life to get a good score.  For instance, if you need to make a structure that is three blocks wide, you only need to support one of those blocks with a conveyor belt, and it doesn't matter which one.  That means you could have a conveyor under the leftmost block with nothing supporting the middle or right blocks, and the whole thing will keep moving along the conveyor as though the center of mass is supported when it clearly isn't.  That diminishes the game somewhat for me, but I realize that's a personal preference and that not everybody will care about that, hence the split recommendation."
550,2481,"It's a mix of Portal and SpaceChem, for people who like Factorio, presented through a blocky Minecraft like medium.How the hell can you not love that?"
551,2481,"Who are your mysterious alien overlords, what do they have you building?!  I bought this game a while ago but never quite got around to playing it.. it's actually pretty fun.  Like all Zachtronics games I love the (morsels of) mysterious story that unfolds as you progress.. and the puzzles do increase in complexity / fun if you stick with it.  The beginning was a little boring at first and I had my doubts.. but I'd recommend this game.  The real fun is in insane solutions, stacking push blocks upon push blocks, having sections of the machine slide out or drop off, anything goes!"
552,2480,"+ Challenging puzzles+ Good controls+ Challenging puzzles+ Good music+ Challenging puzzles+ Comedy, but also death+ Challenging puzzles+ Nice difficulty curve, so instead of feeling like an idiot after 5 minutes, you feel like an idiot after 30 minutes- I'll never finish this game9/10 pretty good"
553,2480,"It has some of the best puzzle gameplay I've ever seen on a Steam game. It's unique with design and items. I've only gotten through some of the levels, but that's enough to know that I'll be keeping this game. I really do recommend this game to anybody who really likes head-scratching puzzles. This game makes you think. Hard."
554,2480,Surprisingly great.21 out of 23.
555,2479,More challenging than portal. Also has lasting gameplay.
556,2478,"I always loved the idea of building a massive factory with conveyors, pistons, turntables, welders, and other things. I was a weird kid. But this game lets me do just that, and while it wants you to use as little parts as possible, i always build the most extravagant factory i can."
557,2478,"It's a Zachtronics game...I mean, look at other Zachtronic titles. Their bars are pretty high, especially Shenzhen I/O and TIS-100. You need to know how to code/how to build circuits.INFINIFACTORY IS DIFFERENT. It's more approachable. You don't need to know how to code. You just build things and the function of each kind of building block is clear enough. As long as you have the ability to think, you can solve the puzzles.After playing other Zachtronic Titles: I'm so stupid and good at nothing(?)After INFINIFACTORY: I can build things? That's fantastic.The background is interesting enough and pretty funnyIf you like intellectual challenges, this is for you!"
558,2478,"Awesome game.I love how there are so many different ways to approach the puzzles, with very differernt solutions.Many of the puzzles are brain twisters for sure."
559,2478,"Great puzzles! Most of them are doable relatively quickly, but you then get to optimize them to your heart's content. 35 hours  in and I only now finished the Overlord campaign. The rest has yet to be played. Fun!"
560,2477,Great factorys.
561,2477,"Game crashes after 5-10 minutes, bringing up a prompt to open a webpage, which then immediatley closes the chosen browser. Looking through the discussion forum, the only solution seems to be putting up with the crashes and making manual save backups, or disabling your antivirus and any cloud backup software you have.Great game, just a shame that this clearly ongoing problem has been allowed to persist."
562,2477,"Quite a nice game, a bit lacking on information early on, but otherwise a nice time killer.The crashing issue was patched October 2018, and thus I'm changing the review to a positive one. Original review as follows:However I cannot recommend this game due to some minor bugs the developer has declined to resolve.(Any transient IO issues will cause the game to crash the game, such as an anti virus scan or cloud provider accessing the savegame)"
563,2477,This is an engaging and increasingly difficult puzzle game. The best part of it though is watching your creation in action. Each solution will be some form of assembly line and watching it operating is mesmerizing and more importantly satisfying as that chain of operations is something you built. Even if it's messy it's yours.
